[
  {
    "ticker": "LNDQ",
    "tool": "news_nl_search",
    "source": "RTRS",
    "date": "2026-10-07",
    "headline": "Lindqvist shares rise after broker upgrade",
    "excerpt": "Shares in Lindqvist rose after a broker raised its rating to buy, citing grid demand, and set a price target of 165 euros."
  },
  {
    "ticker": "LNDQ",
    "tool": "news_nl_search",
    "source": "RTRS",
    "date": "2026-10-07",
    "headline": "Lindqvist shares rise after broker upgrade",
    "excerpt": "Shares in Lindqvist rose after a broker raised its rating to buy, citing grid demand, and set a price target of 165 euros."
  },
  {
    "ticker": "LNDQ",
    "tool": "news_nl_search",
    "source": "RTRS",
    "date": "2026-10-07",
    "headline": "Lindqvist shares rise after broker upgrade",
    "excerpt": "Shares in Lindqvist rose after a broker raised its rating to buy, citing grid demand, and set a price target of 165 euros."
  }
]
